{
  "verdict": "SuspiciousImplantDetected",
  "confidence": 0.79,
  "channels": {
    "ForeignObjectDensityChannel": "LOW",
    "ImplantShapeLikelihoodChannel": "LIKELY_IMPLANT",
    "MaterialRiskChannel": "HIGH",
    "LocationCriticalityChannel": "ELEVATED",
    "ContextualIntentChannel": "HOSTILE_CONTEXT",
    "ScanQualityChannel": "GOOD",
    "AnomalyDensityChannel": "LOW",
    "KnownImplantMatchChannel": "KNOWN_BENIGN"
  },
  "explanation": [
    "Implant matches known benign pattern but appears in a hostile context.",
    "Non-normal shape likelihood with at least medium material risk."
  ],
  "debug": {
    "shapeLikelihood": 0.80,
    "materialRiskScore": 0.62,
    "foreignObjectDensity": 0.04,
    "anomalyDensity": 0.10,
    "scanQualityScore": 0.80
  }
}
