{
  "verdict": "HighRiskImplantDetected",
  "confidence": 0.93,
  "channels": {
    "ForeignObjectDensityChannel": "MEDIUM",
    "ImplantShapeLikelihoodChannel": "LIKELY_IMPLANT",
    "MaterialRiskChannel": "HIGH",
    "LocationCriticalityChannel": "CRITICAL",
    "ContextualIntentChannel": "HOSTILE_CONTEXT",
    "ScanQualityChannel": "GOOD",
    "AnomalyDensityChannel": "HIGH",
    "KnownImplantMatchChannel": "UNKNOWN_PATTERN"
  },
  "explanation": [
    "High implant likelihood, high material risk, and critical location or hostile context."
  ],
  "debug": {
    "shapeLikelihood": 0.91,
    "materialRiskScore": 0.73,
    "foreignObjectDensity": 0.25,
    "anomalyDensity": 0.55,
    "scanQualityScore": 0.72
  }
}
